{
  "schema_version": 1,
  "sample_id": "PERF-DEMO-001",
  "experiment_epoch_id": "PERF-EPOCH-DEMO-001",
  "metric_scope": "RUNTIME_OVERHEAD",
  "sample_role": "OBSERVATION",
  "trial_id": null,
  "workload_id": null,
  "metric_id": null,
  "pair_id": null,
  "sample_index": 0,
  "order_in_pair": "NOT_PAIRED",
  "arm": "PCH_BYPASS",
  "task_class": "PURE_CONVERSATION",
  "runtime_fingerprint": "0000000000000000000000000000000000000000000000000000000000000000",
  "measurements": {
    "provider_requests": 1,
    "input_tokens": null,
    "cache_read_tokens": null,
    "cache_write_tokens": null,
    "output_tokens": null,
    "reasoning_tokens": null,
    "ttft_ms": null,
    "wall_ms": 1,
    "tool_start_delay_ms": null,
    "pch_sync_ms": 1,
    "user_questions": 0,
    "usage_completeness": "UNOBSERVABLE",
    "cache_state": null,
    "eligible_cacheable_prefix_tokens": null,
    "response_directive_input_tokens": null,
    "tool_context_tokens": null,
    "rendered_output_chars": null,
    "artifact_bytes": null,
    "suppressed_progress_events": null,
    "duplicate_output_tokens_estimate": null,
    "first_pass_acceptance_closed": null,
    "omission_followup_count": null,
    "reopen_count": null
  },
  "quality_gate": "NOT_EVALUATED",
  "recorded_at": "2026-07-21T12:00:00Z"
}
